acteurs,annee,description,duree,genre,pays,public,score,titre
"Naveen Kasturia,Arunabh Kumar,Abhay Mahajan",2015–2022,A story of trials and tribulations of four young entrepreneurs who quit their day jobs in order to pursue their start up venture.,40m,Comedy,India,TV-MA,9.1,TVF Pitchers
"John Cleese,Graham Chapman,Terry Gilliam",1969–1974,The original surreal sketch comedy showcase for the Monty Python troupe.,30m,Comedy,United Kingdom,TV-14,8.8,Monty Python's Flying Circus
"Lisa Kudrow,Courteney Cox,Jennifer Aniston",1994–2004,Follows the personal and professional lives of six twenty to thirty year-old friends living in the Manhattan borough of New York City.,22m,Comedy,United States,TV-14,8.9,Friends
,2009,"This six-part series traces the Second World War, from the rise of the Nazis to the surrender of the Japanese, with detailed portraits of key figures.",5h 12m,Documentary,France,TV-MA,9.0,Apocalypse: The Second World War
,2014– ,Former Daily Show host and correspondent John Oliver brings his persona to this weekly news satire program.,30m,Comedy,United States,TV-MA,8.9,Last Week Tonight with John Oliver
"Kaitlin Olson,Charlie Day,Rob McElhenney",2005– ,Five friends with big egos and small brains are the proprietors of an Irish pub in Philadelphia.,22m,Comedy,United States,TV-MA,8.8,It's Always Sunny in Philadelphia
"Ethan Herisse,Asante Blackk,Caleel Harris",2019,Five teens from Harlem become trapped in a nightmare when they're falsely accused of a brutal attack in Central Park. Based on the true story.,4h 56m,Biography,United States,TV-MA,8.9,When They See Us
"Alex Hirsch,Kristen Schaal,Jason Ritter",2012–2016,"Twin siblings Dipper and Mabel Pines spend the summer at their great-uncle's tourist trap in the enigmatic Gravity Falls, Oregon.",23m,Animation,United States,TV-Y7,8.9,Gravity Falls
"Anthony Filosa,Nathan Fielder,Salomon Flores",2013–2017,"Nathan Fielder uses his business degree and life experiences to help real small businesses turn a profit. But because of his unorthodox approach, Nathan's genuine efforts to do good often draw real people into an experience far beyond what they signed up for.",30m,Documentary,United States,TV-14,8.9,Nathan for You
"Martin Freeman,Allison Tolman,Billy Bob Thornton",2014–2023,"Various chronicles of deception, intrigue and murder in and around frozen Minnesota. Yet all of these tales mysteriously lead back one way or another to Fargo, North Dakota.",53m,Crime,United States,TV-MA,8.9,Fargo
"Megumi Hayashibara,Unshô Ishizuka,Kôichi Yamadera",1998–1999,The futuristic misadventures and tragedies of an easygoing bounty hunter and his partners.,24m,Animation,Japan,TV-14,8.9,Cowboy Bebop
,2021,Documentary about the music group The Beatles featuring in-studio footage that was shot in early 1969 for the 1970 feature film 'Let It Be.',7h 48m,Documentary,United Kingdom,PG-13,9.0,The Beatles: Get Back
,2018,A man diagnosed with Alzheimer's decides to punish criminals.,1h 5m,Crime,Turkey,TV-MA,9.0,Persona
,1989–1990,"Ten television drama films, each one based on one of the Ten Commandments.",9h 32m,Drama,Poland,TV-MA,9.0,Dekalog
"Cristina Valenzuela,Megumi Han,Issei Futamata",2011–2014,"Gon Freecss aspires to become a Hunter, an exceptional being capable of greatness. With his friends and his potential, he seeks out his father, who left him when he was younger.",24m,Animation,Japan,TV-14,9.0,Hunter x Hunter
"Jerry Seinfeld,Michael Richards,Julia Louis-Dreyfus",1989–1998,The continuing misadventures of neurotic New York City stand-up comedian Jerry Seinfeld and his equally neurotic New York City friends.,22m,Comedy,United States,TV-PG,8.9,Seinfeld
"Rachel McAdams,Colin Farrell,Vince Vaughn",2014– ,"Seasonal anthology series in which police investigations unearth the personal and professional secrets of those involved, both within and outside the law.",55m,Crime,United States,TV-MA,8.9,True Detective
,1990,A comprehensive survey of the American Civil War.,11h 20m,Documentary,United States,TV-14,9.1,The Civil War
"David Jason,Nicholas Lyndhurst,Roger Lloyd Pack",1981–2003,Comedy that follows two brothers from London's rough Peckham estate as they wheel and deal through a number of dodgy deals and search for the big score that'll make them millionaires.,1h 35m,Comedy,United Kingdom,TV-PG,9.0,Only Fools and Horses
,2006–2007,An intelligent high school student goes on a secret crusade to eliminate criminals from the world after discovering a notebook capable of killing anyone whose name is written into it.,23m,Animation,Japan,TV-14,9.0,Death Note
"Bob Odenkirk,Rhea Seehorn,Jonathan Banks",2015–2022,The trials and tribulations of criminal lawyer Jimmy McGill in the years leading up to his fateful run-in with Walter White and Jesse Pinkman.,46m,Crime,United States,TV-MA,8.9,Better Call Saul
,2021– ,Follow Jeremy Clarkson as he attempts to run a farm in the countryside.,45m,Documentary,United Kingdom,TV-PG,9.0,Clarkson's Farm
"Jenna Fischer,Steve Carell,John Krasinski",2005–2013,"A mockumentary on a group of typical office workers, where the workday consists of ego clashes, inappropriate behavior, and tedium.",22m,Comedy,United States,TV-14,9.0,The Office
,2001,"Mammoth series, five years in the making, taking a look at the rich tapestry of life in the world's oceans.",6h 29m,Documentary,United Kingdom,TV-G,9.0,The Blue Planet
,2021– ,"Set in Utopian Piltover and the oppressed underground of Zaun, the story follows the origins of two iconic League Of Legends champions and the power that will tear them apart.",41m,Animation,United States,TV-14,9.0,Arcane
"Alan Tudyk,Gina Torres,Nathan Fillion",2002–2003,"Five hundred years in the future, a renegade crew aboard a small spacecraft tries to survive as they travel the unknown parts of the galaxy and evade warring factions as well as authority agents out to get them.",44m,Adventure,United States,TV-14,9.0,Firefly
,2011–2012,Focuses on life and the environment in both the Arctic and Antarctic.,5h 33m,Documentary,United Kingdom,TV-PG,9.0,Frozen Planet
,2011,A cinematic experience bringing you the most amazing human stories in the world. Humans and wildlife surviving in the most extreme environments on Earth,50m,Documentary,United Kingdom,TV-PG,9.0,Human Planet
"Efrem Zimbalist Jr.,Kevin Conroy,Loren Lester",1992–1995,The Dark Knight battles crime in Gotham City with occasional help from Robin and Batgirl.,23m,Animation,United States,TV-PG,9.0,Batman: The Animated Series
,2020,"Set in 1980s and '90s Bombay, it follows the life of Harshad Mehta, a stockbroker who took the stock market to dizzying heights and his catastrophic downfall.",54m,Biography,India,TV-14,9.3,Scam 1992: The Harshad Mehta Story
"Melanie Zanetti,David McCormack,Rico Romaniuk",2018– ,The slice-of-life adventures of an Australian Blue Heeler Cattle Dog puppy as she has fun with her family and friends in everyday situations.,7m,Animation,Australia,TV-Y,9.5,Bluey
,2013–2023,"After his hometown is destroyed and his mother is killed, young Eren Jaeger vows to cleanse the earth of the giant humanoid Titans that have brought humanity to the brink of extinction.",24m,Animation,Japan,TV-MA,9.0,Attack on Titan
,2017,A comprehensive history of the United States' involvement in the bitterly divisive armed conflict in Southeast Asia.,16h 30m,Documentary,United States,TV-MA,9.1,The Vietnam War
"Martin Freeman,Benedict Cumberbatch,Una Stubbs",2010–2017,A modern update finds the famous sleuth and his doctor partner solving crime in 21st-century London.,1h 28m,Crime,United Kingdom,TV-14,9.1,Sherlock
"Jay Overholts,Rod Serling,Robert McCord",1959–1964,"Ordinary people find themselves in extraordinarily astounding situations, which they each try to solve in a remarkable manner.",51m,Drama,United States,TV-PG,9.1,The Twilight Zone
,2020,"Charting the rise of the 1990s Chicago Bulls, led by Michael Jordan, one of the most notable dynasties in sports history.",8h 11m,Documentary,United States,TV-MA,9.1,The Last Dance
,2009,David Attenborough's legendary BBC crew explains and shows wildlife all over planet earth. From giving an overview of the challenges facing life to hunting the deep sea and various major evolutionary groups of creatures.,7h 53m,Documentary,United Kingdom,TV-G,9.1,Life
